{
  "contractId": "circuit-presentation-output.v1",
  "inputDigest": "9a1ff2aa863e321b0b216af375c3864b182643ca384b9c9c9a1ca2991659b2d7",
  "contentDigest": "ee1d329bb9e4248a45352f1b0f43ce761291212dde35b4746b8ee7bcdb3176f8",
  "title": "design-intent-and-scope — capability — 3",
  "pageSize": {
    "width": 960,
    "height": 540,
    "unit": "PT"
  },
  "slides": [
    {
      "id": "capability_v3_s1",
      "title": "Inspection evidence",
      "notes": "[\n  {\n    \"id\": \"V55\",\n    \"reading\": \"capability-proof-obligations\",\n    \"property\": \"pattern-vocabulary-binding\",\n    \"disposition\": \"NOT_FORMALLY_OBSERVABLE\",\n    \"basis\": \"0 of 4795 selected estate definitions with a pattern key; the mapping from the ordinal operation list to the declared pattern semantics is compiler behaviour, not a declared row\",\n    \"nodeIds\": [],\n    \"scenarioIds\": [],\n    \"sourceRef\": \"snapshot:/inspection/readings/13/document/capabilities\",\n    \"rowIndex\": 11,\n    \"raw\": {\n      \"obligation\": \"pattern-vocabulary-binding\",\n      \"disposition\": \"NOT_FORMALLY_OBSERVABLE\",\n      \"basis\": \"0 of 4795 selected estate definitions with a pattern key; the mapping from the ordinal operation list to the declared pattern semantics is compiler behaviour, not a declared row\",\n      \"scope\": {\n        \"semanticsVersion\": \"sda-execution-patterns/vectors.v1 + sda-execution-graph/mechanics/*.v1\",\n        \"sdaCommit\": \"cc5791b907bfb24e65b5b601c135ea9123a77bbe\",\n        \"conformanceVerified\": false,\n        \"conformanceBasis\": \"installed kernel is csharp: no execution-pattern-vector conformance test; node and python run the vectors\"\n      }\n    }\n  },\n  {\n    \"id\": \"V56\",\n    \"reading\": \"capability-proof-obligations\",\n    \"property\": \"interpreter-conformance\",\n    \"disposition\": \"NOT_FORMALLY_OBSERVABLE\",\n    \"basis\": \"installed kernel is csharp and has no execution-pattern-vector conformance test; node and python run the vectors\",\n    \"nodeIds\": [],\n    \"scenarioIds\": [],\n    \"sourceRef\": \"snapshot:/inspection/readings/13/document/capabilities\",\n    \"rowIndex\": 12,\n    \"raw\": {\n      \"obligation\": \"interpreter-conformance\",\n      \"disposition\": \"NOT_FORMALLY_OBSERVABLE\",\n      \"basis\": \"installed kernel is csharp and has no execution-pattern-vector conformance test; node and python run the vectors\",\n      \"scope\": {\n        \"semanticsVersion\": \"sda-execution-patterns/vectors.v1 + sda-execution-graph/mechanics/*.v1\",\n        \"sdaCommit\": \"cc5791b907bfb24e65b5b601c135ea9123a77bbe\",\n        \"conformanceVerified\": false,\n        \"conformanceBasis\": \"installed kernel is csharp: no execution-pattern-vector conformance test; node and python run the vectors\"\n      }\n    }\n  },\n  {\n    \"id\": \"R01\",\n    \"severity\": \"warning\",\n    \"code\": \"BINDING_NOT_INVOKED\",\n    \"message\": \"Binding design-intent-and-scope-port has no invoking operation in the selected graph.\",\n    \"nodeIds\": [\n      \"binding:design-intent-and-scope-port\"\n    ],\n    \"sourceRefs\": [\n      \"graph:/interfaceAuthority/portBindings/0\"\n    ],\n    \"resolvedNodeIds\": [\n      \"binding:design-intent-and-scope-port\"\n    ],\n    \"scenarioIds\": [],\n    \"addressStatus\": \"LOCATED\",\n    \"repair\": {\n      \"status\": \"MAPPED\",\n      \"declaration\": {\n        \"findingCode\": \"BINDING_NOT_INVOKED\",\n        \"disposition\": \"REPAIR\",\n        \"repairProcedure\": \"model.remove_scenario_operations\",\n        \"parameterContract\": \"blueprint-finding-repair-parameters.v1\",\n        \"requiredParameters\": [\n          \"capability_id\",\n          \"scenario\"\n        ],\n        \"parameterDefaults\": {\n          \"operation_ids\": null,\n          \"remove_uninvoked_bindings\": true\n        },\n        \"nextUnit\": null\n      },\n      \"requiredParameters\": [\n        \"capability_id\",\n        \"scenario\"\n      ],\n      \"execution\": \"Not attempted\",\n      \"closure\": \"Not verified\"\n    }\n  }\n]\n\nEvidence references:\nsnapshot:/inspection/readings/13/document/capabilities\ngraph:/interfaceAuthority/portBindings/0\n\nSnapshot: cd0fc0a5a882afa1f143b157d489ca7a811f1ed97cbffef0674b00553c2d9197\n\nFull identities, relationships, and detail: snapshot.json, circuit-model.json, storyboard.json.",
      "requests": [
        {
          "updatePageProperties": {
            "objectId": "capability_v3_s1",
            "pageProperties": {
              "pageBackgroundFill": {
                "solidFill": {
                  "color": {
                    "rgbColor": {
                      "red": 0.023529411764705882,
                      "green": 0.06666666666666667,
                      "blue": 0.12156862745098039
                    }
                  },
                  "alpha": 1
                }
              }
            },
            "fields": "pageBackgroundFill"
          }
        },
        {
          "createShape": {
            "objectId": "capability_v3_s1_o1",
            "shapeType": "TEXT_BOX",
            "elementProperties": {
              "pageObjectId": "capability_v3_s1",
              "size": {
                "width": {
                  "magnitude": 880,
                  "unit": "PT"
                },
                "height": {
                  "magnitude": 49,
                  "unit": "PT"
                }
              },
              "transform": {
                "scaleX": 1,
                "scaleY": 1,
                "translateX": 34,
                "translateY": 22,
                "unit": "PT"
              }
            }
          }
        },
        {
          "insertText": {
            "objectId": "capability_v3_s1_o1",
            "insertionIndex": 0,
            "text": "Inspection evidence"
          }
        },
        {
          "updateTextStyle": {
            "objectId": "capability_v3_s1_o1",
            "textRange": {
              "type": "ALL"
            },
            "style": {
              "fontFamily": "Arial",
              "fontSize": {
                "magnitude": 31,
                "unit": "PT"
              },
              "bold": true,
              "foregroundColor": {
                "opaqueColor": {
                  "rgbColor": {
                    "red": 0.9568627450980393,
                    "green": 0.9686274509803922,
                    "blue": 0.984313725490196
                  }
                }
              }
            },
            "fields": "fontFamily,fontSize,bold,foregroundColor"
          }
        },
        {
          "updateParagraphStyle": {
            "objectId": "capability_v3_s1_o1",
            "textRange": {
              "type": "ALL"
            },
            "style": {
              "alignment": "START",
              "spaceAbove": {
                "magnitude": 0,
                "unit": "PT"
              },
              "spaceBelow": {
                "magnitude": 0,
                "unit": "PT"
              },
              "lineSpacing": 108
            },
            "fields": "alignment,spaceAbove,spaceBelow,lineSpacing"
          }
        },
        {
          "createShape": {
            "objectId": "capability_v3_s1_o2",
            "shapeType": "TEXT_BOX",
            "elementProperties": {
              "pageObjectId": "capability_v3_s1",
              "size": {
                "width": {
                  "magnitude": 876,
                  "unit": "PT"
                },
                "height": {
                  "magnitude": 44,
                  "unit": "PT"
                }
              },
              "transform": {
                "scaleX": 1,
                "scaleY": 1,
                "translateX": 36,
                "translateY": 77,
                "unit": "PT"
              }
            }
          }
        },
        {
          "insertText": {
            "objectId": "capability_v3_s1_o2",
            "insertionIndex": 0,
            "text": "SOURCE RESULTS · PROPERTY SCOPE · REPAIR READINESS"
          }
        },
        {
          "updateTextStyle": {
            "objectId": "capability_v3_s1_o2",
            "textRange": {
              "type": "ALL"
            },
            "style": {
              "fontFamily": "Arial",
              "fontSize": {
                "magnitude": 14,
                "unit": "PT"
              },
              "bold": false,
              "foregroundColor": {
                "opaqueColor": {
                  "rgbColor": {
                    "red": 0.6588235294117647,
                    "green": 0.7215686274509804,
                    "blue": 0.792156862745098
                  }
                }
              }
            },
            "fields": "fontFamily,fontSize,bold,foregroundColor"
          }
        },
        {
          "updateParagraphStyle": {
            "objectId": "capability_v3_s1_o2",
            "textRange": {
              "type": "ALL"
            },
            "style": {
              "alignment": "START",
              "spaceAbove": {
                "magnitude": 0,
                "unit": "PT"
              },
              "spaceBelow": {
                "magnitude": 0,
                "unit": "PT"
              },
              "lineSpacing": 108
            },
            "fields": "alignment,spaceAbove,spaceBelow,lineSpacing"
          }
        },
        {
          "createShape": {
            "objectId": "capability_v3_s1_o3",
            "shapeType": "TEXT_BOX",
            "elementProperties": {
              "pageObjectId": "capability_v3_s1",
              "size": {
                "width": {
                  "magnitude": 36,
                  "unit": "PT"
                },
                "height": {
                  "magnitude": 20,
                  "unit": "PT"
                }
              },